id,user,content,platform,timestamp,risk_score,type,url,query_source,original_content,language,final_threat,status
9eac36dfdf9c,dark_knight_97,dm for menu. shipping worldwide. ioo% legit steroids. esafe esteroids,Instagram,2025-12-29T16:07:53.898060,76,Dealer,#,simulation,DM for menu. Shipping worldwide. 100% legit Steroids. #safe #Steroids,en,99,CRITICAL
a45531a55946,blue_sky_31,dm for menu. shipping worldwide. ioo% legit steroids. esafe esteroids,Instagram,2025-12-29T16:07:53.898174,96,Dealer,#,simulation,DM for menu. Shipping worldwide. 100% legit Steroids. #safe #Steroids,en,99,CRITICAL
9170d7907f75,anon_user_28,bulk orders of steroids available. wickr me: fastplug. price list in bio.,Instagram,2025-12-29T16:07:53.898206,75,Dealer,#,simulation,Bulk orders of Steroids available. Wickr me: fastplug. Price list in bio.,en,99,CRITICAL
59965b124e71,city_plug_67,bulk orders of mtp kit available. wickr me: fastplug. price list in bio.,Reddit,2025-12-29T16:07:53.898228,91,Dealer,#,simulation,Bulk orders of MTP Kit available. Wickr me: fastplug. Price list in bio.,en,99,CRITICAL
80661f527999,anon_user_66,mtp kit available fast shipping. no prescription needed.,Reddit,2025-12-29T16:07:53.898248,89,Dealer,#,simulation,MTP Kit available fast shipping. No prescription needed.,en,99,CRITICAL
8c1537efca23,dark_knight_54,selling leftover script steroids. dm me for prices. cash/btc only.,Instagram,2025-12-29T16:07:53.898269,88,Dealer,#,simulation,Selling leftover script Steroids. DM me for prices. Cash/BTC only.,en,99,CRITICAL
d7cccdd6caca,dark_knight_17,dm for menu. shipping worldwide. ioo% legit oxy. esafe eoxy,Reddit,2025-12-29T16:07:53.898293,96,Dealer,#,simulation,DM for menu. Shipping worldwide. 100% legit Oxy. #safe #Oxy,en,99,CRITICAL
