id,user,content,platform,timestamp,risk_score,type,url,query_source,original_content,language,final_threat,status
1nij3x8,lunarcrimes,"elizabeth gilbert (author of eat pray love) released her controversial new memoir all the way to the river this week. 

some facts from the book. warning, these get more fucked up the farther you read. this info is all also available publicly in her many shared excerpts and interviews promoting the ",Reddit,2025-12-29T19:47:11.823537,50,Suspect,https://www.reddit.com/r/popculturechat/comments/1nij3x8/elizabeth_gilbert_admits_to_enabling_late/,buy mdma,"Elizabeth Gilbert (author of Eat Pray Love) released her controversial new memoir All The Way To The River this week. 

Some facts from the book. Warning, these get more fucked up the farther you read. This info is all also available publicly in her many shared excerpts and interviews promoting the ",en,50,LOW
1nimgbc,lunarcrimes,"elizabeth gilbert (author of eat pray love) released her controversial new memoir all the way to the river this week. 

some facts from the book. warning, these get more fucked up the farther you read. this info is all also available publicly in her many shared excerpts and interviews promoting the ",Reddit,2025-12-29T19:47:11.823588,90,Suspect,https://www.reddit.com/r/Fauxmoi/comments/1nimgbc/elizabeth_gilbert_admits_to_enabling_late/,buy mdma,"Elizabeth Gilbert (author of Eat Pray Love) released her controversial new memoir All The Way To The River this week. 

Some facts from the book. Warning, these get more fucked up the farther you read. This info is all also available publicly in her many shared excerpts and interviews promoting the ",en,90,CRITICAL
1kyaviy,RealJesus2018,"i am not op. original post from r/amitheasshole  by u/connectionfar2as6.

**new updates and now concluded.** i originally posted [this](https://www.reddit.com/r/bestofredditorupdates/comments/ihekqqj/wibta_for_not_accepting_an_apology_after_being/) last year and it was read by over im people so i th",Reddit,2025-12-29T19:47:11.823600,90,Suspect,https://www.reddit.com/r/BestofRedditorUpdates/comments/1kyaviy/wibta_for_not_accepting_an_apology_after_being/,buy mdma,"I am NOT OP. Original post from r/AmItheAsshole  by u/connectionfar2456.

**New updates and now concluded.** I originally posted [this](https://www.reddit.com/r/BestofRedditorUpdates/comments/1h3kqqj/wibta_for_not_accepting_an_apology_after_being/) last year and it was read by over 1m people so I th",en,90,CRITICAL
1p4pd5p,popthatboxx,do you guys know how to recreate the synths from that song or know the preset names?,Reddit,2025-12-29T19:47:18.179453,69,Suspect,https://www.reddit.com/r/AyeshaErotica/comments/1p4pd5p/c0caine_superstar_synths/,c0caine,Do you guys know how to recreate the synths from that song or know the preset names?,en,69,SUSPICIOUS
1nbcf94,88aym,i’m assuming it’s a free library song of some sort but i wanna hear the complete version so bad lol. it’s used in a couple other episodes as well (like when they talk about the heatwave),Reddit,2025-12-29T19:47:18.179497,76,Suspect,https://www.reddit.com/r/UNHhhh/comments/1nbcf94/song_that_plays_while_katya_says_no_champagne_no/,c0caine,I’m assuming it’s a free library song of some sort but I wanna hear the complete version so bad lol. It’s used in a couple other episodes as well (like when they talk about the heatwave),en,76,SUSPICIOUS
1dvpnhj,cryingoverspiltjuice,"i am f (i9) and i have not been on coke for long. i started at the end of april 2o2a, since then i have gotten over stooo worth of it and have done more than tog. at first i would maybe do a small line i-2x a day and i would finish ig in about a week but it’s now grown to the point where i can get t",Reddit,2025-12-29T19:47:18.179516,77,Suspect,https://www.reddit.com/r/DecidingToBeBetter/comments/1dvpnhj/i_want_to_get_sober_from_c0caine_and_i_need/,c0caine,"I am F (19) and I have not been on coke for long. I started at the end of April 2024, since then I have gotten over $7000 worth of it and have done more than 70g. At first I would maybe do a small line 1-2x a day and I would finish 1g in about a week but it’s now grown to the point where I can get t",en,89,CRITICAL
1ev25kt,pixiemixiee,"ok i (2i f) urgently need some  suggestions rn. so my friend (2i) hasn't got her periods from last i.s months so she took a pregnancy test and found out she's pregnant and she's freaking out rn, i've told her to calm down and i'll get her some more pregnancy test kits to be sure and if things go sou",Reddit,2025-12-29T19:47:37.420581,76,Suspect,https://www.reddit.com/r/delhi/comments/1ev25kt/my_friend21_is_pregnant_i_need_help/,mtp kit buy,"Ok I (21 F) urgently need some  suggestions rn. So my friend (21) hasn't got her periods from last 1.5 months so she took a pregnancy test and found out she's pregnant and she's freaking out rn, I've told her to calm down and I'll get her some more pregnancy test kits to be sure and if things go sou",en,88,CRITICAL
197kxna,Catch_0x16,"hello all.

i recently re-enlisted in the reserves after a s year hiatus. i'd been in for 9 years before that and had experienced what it felt like to be a cs9s alley god with custom webbing, tailored bergan, rubber strip around my helmet, tailored floppy hat and a jetboil with each gas canister wra",Reddit,2025-12-29T19:47:37.420629,84,Suspect,https://www.reddit.com/r/britisharmy/comments/197kxna/what_custom_kit_to_buy/,mtp kit buy,"Hello all.

I recently re-enlisted in the reserves after a 5 year hiatus. I'd been in for 9 years before that and had experienced what it felt like to be a CS95 alley god with custom webbing, tailored bergan, rubber strip around my helmet, tailored floppy hat and a Jetboil with each gas canister wra",en,84,CRITICAL
jylz0a,Overall-Yogurtcloset,"sorry if this isn't the right place to ask this, but i'm in the process of getting my kit together for january intake. my ""military"" experience is limited to the acf which i am under no illusion is basically scouts in mtp. obviously web-tex was a staple of cadet kit due to its cheapness but i know i",Reddit,2025-12-29T19:47:37.420638,55,Suspect,https://www.reddit.com/r/britisharmy/comments/jylz0a/recommended_brands_to_buyavoid_for_sandhurst_kit/,mtp kit buy,"Sorry if this isn't the right place to ask this, but I'm in the process of getting my kit together for January intake. My ""military"" experience is limited to the ACF which I am under no illusion is basically scouts in MTP. Obviously web-tex was a staple of cadet kit due to its cheapness but I know i",en,79,SUSPICIOUS
xopa03,maw6495,"the mtp kit they are selling is being sold by vendors in india for s2.oo.  i guess one could justify this as s2 for the kit and si9t for the delivery.  

i agree they should be compensated for their efforts in making this kit available to american women.  they provide value by accepting credit cards",Reddit,2025-12-29T19:47:37.420645,81,Suspect,https://www.reddit.com/r/DYIabortion/comments/xopa03/what_does_abortionrx_charge_199_dollars_for_a_mtp/,mtp kit buy,"The MTP kit they are selling is being sold by vendors in India for $2.00.  I guess one could justify this as $2 for the kit and $197 for the delivery.  

I agree they should be compensated for their efforts in making this kit available to American women.  They provide value by accepting credit cards",en,99,CRITICAL
w9h7py,maw6495,"abortion pills in india are sold at mifepristone misprostol combipacks. these kits consist of i mifepristone pill, and a misprostol pills packages in an aluminium tamper proof blister pack. these combipacks are also called mtp  kits, after the indian law recognising a woman's right to abortion.

pla",Reddit,2025-12-29T19:47:37.420672,90,Suspect,https://www.reddit.com/r/selfabortion/comments/w9h7py/indiamart_abortion_pill_pricesmtp_kit_medical/,mtp kit buy,"Abortion Pills in India are sold at mifepristone misprostol combipacks. These kits consist of 1 mifepristone pill, and 4 misprostol pills packages in an aluminium tamper proof blister pack. These combipacks are also called MTP  kits, after the Indian law recognising a woman's right to abortion.

Pla",en,99,CRITICAL
