id,user,content,platform,timestamp,risk_score,type,url,query_source,original_content,language,final_threat,status
ccff342bd590,crypto_vendor_99,discrete delivery of steroids available in delhi/mumbai. cash on delivery.,Reddit,2025-12-29T16:15:23.951873,84,Dealer,#,simulation,Discrete delivery of Steroids available in Delhi/Mumbai. Cash on delivery.,en,99,CRITICAL
4cd66fd9b46d,meds_24x7_91,dm for menu. shipping worldwide. ioo% legit steroids. esafe esteroids,Instagram,2025-12-29T16:15:23.951923,88,Dealer,#,simulation,DM for menu. Shipping worldwide. 100% legit Steroids. #safe #Steroids,en,99,CRITICAL
d023f19256e3,blue_sky_35,dm for menu. shipping worldwide. ioo% legit xanax. esafe exanax,Reddit,2025-12-29T16:15:23.951936,76,Dealer,#,simulation,DM for menu. Shipping worldwide. 100% legit Xanax. #safe #Xanax,en,99,CRITICAL
18553f6db574,city_plug_44,mtp kit available fast shipping. no prescription needed.,Telegram,2025-12-29T16:15:23.951946,81,Dealer,#,simulation,MTP Kit available fast shipping. No prescription needed.,en,99,CRITICAL
ad703589ccb1,dark_knight_77,mtp kit available fast shipping. no prescription needed.,Instagram,2025-12-29T16:15:23.951954,81,Dealer,#,simulation,MTP Kit available fast shipping. No prescription needed.,en,99,CRITICAL
1114e0ffff8f,meds_24x7_69,dm for menu. shipping worldwide. ioo% legit steroids. esafe esteroids,Reddit,2025-12-29T16:15:23.951962,91,Dealer,#,simulation,DM for menu. Shipping worldwide. 100% legit Steroids. #safe #Steroids,en,99,CRITICAL
5c199e476fbc,city_plug_46,selling leftover script mtp kit. dm me for prices. cash/btc only.,Instagram,2025-12-29T16:15:23.951972,78,Dealer,#,simulation,Selling leftover script MTP Kit. DM me for prices. Cash/BTC only.,en,99,CRITICAL
4650c8f33fb4,city_plug_21,discrete delivery of weed available in delhi/mumbai. cash on delivery.,Telegram,2025-12-29T16:15:23.951980,86,Dealer,#,simulation,Discrete delivery of Weed available in Delhi/Mumbai. Cash on delivery.,en,99,CRITICAL
298c4730738d,anon_user_96,touchdowni new stock of oxy just landed. telegram link in bio.,Reddit,2025-12-29T16:15:23.951987,99,Dealer,#,simulation,Touchdown! New stock of Oxy just landed. Telegram link in bio.,en,99,CRITICAL
