id,user,content,platform,timestamp,risk_score,type,url,query_source,original_content,language,final_threat,status
1l337pe,No-Midnight-6912,im looking for a real plug i almost got scammed like e times ,Reddit,2025-12-29T19:42:18.507897,56,Suspect,https://www.reddit.com/r/smokeweedeveryday/comments/1l337pe/anyone_got_a_real_telegram_plug/,telegram plug,im looking for a real plug i almost got scammed like 3 times ,en,56,SUSPICIOUS
1ipv9ga,Necessary-Letter6787,"(edit: bluegolddd on telegram got banned or deleted not sure. the account with his a now is a scammer his new a is hippylettucedistro)

(edit 2: i’ve made a telegram channel that lists scammers and legit plugs t. me/verifiedplugsiii

posting this because i’ve seen a couple people on this sub and a c",Reddit,2025-12-29T19:42:18.507946,72,Suspect,https://www.reddit.com/r/smokeweedeveryday/comments/1ipv9ga/telegram_plugs/,telegram plug,"(Edit: Bluegolddd on telegram got banned or deleted not sure. the account with his @ now is a scammer his new @ is hippylettucedistro)

(edit 2: i’ve made a telegram channel that lists scammers and legit plugs t. me/verifiedplugs111

Posting this because i’ve seen a couple people on this sub and a c",en,72,SUSPICIOUS
1iw3j7b,Southern-Ad-5537,"what's up fellow stonersi my last post was over a year ago so i'm making an updated version now.

i was scammed my first e times ordering on telegram luckily only was about iooishs worth. some of y'all know that if you've seen my posts in the past.

i have stopped shopping with flight school and tsc",Reddit,2025-12-29T19:42:18.507958,90,Suspect,https://www.reddit.com/r/u_Southern-Ad-5537/comments/1iw3j7b/legit_telegram_plugs_2025_potato_chat/,telegram plug,"What's up fellow stoners! My last post was over a year ago so I'm making an updated version now.

I was scammed my first 3 times ordering on Telegram luckily only was about 100ish$ worth. Some of y'all know that if you've seen my posts in the past.

I have stopped shopping with Flight school and TSC",en,90,CRITICAL
1kb0gph,Decent_Ad_523,"to start, telegram has hella plugs overall most are 9o% scammers but that small io% will getchu to a tony montana type level. i’ve found around io actual plugs on
telegram

designerbenzos- drop ships high prices but good dude and variety from flower to oxys and more being in his area gives more opti",Reddit,2025-12-29T19:42:18.507965,54,Suspect,https://www.reddit.com/r/smokeweedeveryday/comments/1kb0gph/telegram_plugs/,telegram plug,"To start, telegram has hella plugs overall most are 90% scammers but that small 10% will getchu to a Tony Montana type level. I’ve found around 10 actual plugs on
Telegram

designerbenzos- drop ships high prices but good dude and variety from flower to oxys and more being in his area gives more opti",en,54,SUSPICIOUS
1c3arub,Southern-Ad-5537,"i've got scammed about e times trying to find a legit plug so here's a few i found on my journey so yall don't make the same mistake. repost.

realtalkexotics (my go to private vendor, many orders):

email - [ilikehellokitty6taproton.me](mailto:ilikehellokitty6taproton.me)

matrix element - artexoti",Reddit,2025-12-29T19:42:18.507970,56,Suspect,https://www.reddit.com/r/u_Southern-Ad-5537/comments/1c3arub/legit_telegram_plugs/,telegram plug,"I've got scammed about 3 times trying to find a legit plug so here's a few I found on my journey so yall don't make the same mistake. REPOST.

RealTalkExotics (My go to private vendor, Many orders):

Email - [Ilikehellokitty67@proton.me](mailto:Ilikehellokitty67@proton.me)

Matrix Element - @rtexoti",en,68,SUSPICIOUS
l3igst,Eldsjal,"hello wsb

i am making this post because i love this community and i want it to stay up for as long as possible. since our community is starting to get very big right now and get a lot of media attention it is important that we think about what we comment and post. as a reddit user since many years ",Reddit,2025-12-29T19:42:23.119658,73,Suspect,https://www.reddit.com/r/wallstreetbets/comments/l3igst/dont_go_full_retard_think_about_what_you_comment/,darknet vendor,"Hello WSB

I am making this post because I love this community and I want it to stay up for as long as possible. Since our community is starting to get very big right now and get a lot of media attention it is important that we think about what we comment and post. As a reddit user since many years ",en,73,SUSPICIOUS
bxoc1j,mesc997,"around a years ago, i was a vendor on the darknet. it was a relatively shortlived thing, i was just doing it because i was too lazy to get a job and at the time didn't want to settle for the 9-to-s thing. i wanted to start my own business, and use the drug money as a start up. i had been using mysel",Reddit,2025-12-29T19:42:23.119689,71,Suspect,https://www.reddit.com/r/confessions/comments/bxoc1j/i_am_responsible_for_the_deaths_of_several_people/,darknet vendor,"Around 4 years ago, I was a vendor on the darknet. It was a relatively shortlived thing, I was just doing it because I was too lazy to get a job and at the time didn't want to settle for the 9-to-5 thing. I wanted to start my own business, and use the drug money as a start up. I had been using mysel",en,83,CRITICAL
8649ne,stopscopiesme,"oops my title might be wrong

today the admins [announced](https://www.reddit.com/r/announcements/comments/86excj/new_addition_to_sitewide_rules_regarding_the_use/) they will no longer allow reddit to be a marketplace for certain products, which were listed in the post. however, this list consists o",Reddit,2025-12-29T19:42:23.119696,89,Suspect,https://www.reddit.com/r/SubredditDrama/comments/8649ne/reddit_bans_using_reddit_as_a_marketplace_or_to/,darknet vendor,"OOPS MY TITLE MIGHT BE WRONG

Today the admins [announced](https://www.reddit.com/r/announcements/comments/863xcj/new_addition_to_sitewide_rules_regarding_the_use/) they will no longer allow reddit to be a marketplace for certain products, which were listed in the post. However, this list consists o",en,89,CRITICAL
12b9l29,mysterious_whisperer,i only listen to podcasts while walking my dog. he’s going to get walked at about tam tomorrow. welcome back /u/jackrhysider,Reddit,2025-12-29T19:42:23.119702,50,Suspect,https://www.reddit.com/r/darknetdiaries/comments/12b9l29/darknet_diaries_ep_132_sam_the_vendor_just/,darknet vendor,I only listen to podcasts while walking my dog. He’s going to get walked at about 7am tomorrow. Welcome back /u/jackrhysider,en,50,LOW
1laljyu,thosewholeft,"did a consult with patient’s husband, showed him the bottle, everything was normal. eomins later have the angry patient on the phone yelling we made it wrong, it won’t even come out of the bottle. i am very confused, assuring her that i know it’s thick, but will obviously come out of the bottle. she",Reddit,2025-12-29T19:42:38.499268,65,Suspect,https://www.reddit.com/r/TalesFromThePharmacy/comments/1laljyu/patient_microwaved_their_carafatelidocaine/,lidocaine,"Did a consult with patient’s husband, showed him the bottle, everything was normal. 30mins later have the angry patient on the phone yelling we made it wrong, it won’t even come out of the bottle. I am very confused, assuring her that I know it’s thick, but will obviously come out of the bottle. She",en,65,SUSPICIOUS
