id,user,content,platform,timestamp,risk_score,type,url,query_source
55e49dbc2a6a,dark_knight_29,Brother need Steroids? I have best quality maal. Contact me.,Instagram,2025-12-29T16:05:47.963709,77,Dealer,#,simulation
e4f43e0b07ad,blue_sky_63,DM for menu. Shipping worldwide. 100% legit MTP Kit. #safe #MTP Kit,Instagram,2025-12-29T16:05:47.963807,84,Dealer,#,simulation
b2522aacee64,crypto_vendor_85,DM for menu. Shipping worldwide. 100% legit Steroids. #safe #Steroids,Telegram,2025-12-29T16:05:47.963839,82,Dealer,#,simulation
fc2076f507e0,meds_24x7_22,Discrete delivery of Steroids available in Delhi/Mumbai. Cash on delivery.,Reddit,2025-12-29T16:05:47.963863,78,Dealer,#,simulation
fc0e7710f8b5,blue_sky_27,DM for menu. Shipping worldwide. 100% legit Charas. #safe #Charas,Reddit,2025-12-29T16:05:47.963886,77,Dealer,#,simulation
0aecf48378fe,dark_knight_43,DM for menu. Shipping worldwide. 100% legit Charas. #safe #Charas,Telegram,2025-12-29T16:05:47.963906,90,Dealer,#,simulation
ed12efcc85d6,anon_user_76,MTP Kit available fast shipping. No prescription needed.,Reddit,2025-12-29T16:05:47.963927,99,Dealer,#,simulation
85e179bd8376,meds_24x7_53,Discrete delivery of Oxy available in Delhi/Mumbai. Cash on delivery.,Telegram,2025-12-29T16:05:47.963944,98,Dealer,#,simulation
