id,user,content,platform,timestamp,risk_score,type,url,query_source
4fd61f76b4ab,crypto_vendor_57,Brother need MTP Kit? I have best quality maal. Contact me.,Telegram,2025-12-29T15:56:15.626302,99,Dealer,#,simulation
12d4187618ba,city_plug_47,DM for menu. Shipping worldwide. 100% legit Steroids. #safe #Steroids,Instagram,2025-12-29T15:56:15.626610,90,Dealer,#,simulation
77c087da9a23,blue_sky_74,Bulk orders of Steroids available. Wickr me: fastplug. Price list in bio.,Reddit,2025-12-29T15:56:15.626754,98,Dealer,#,simulation
1a94e25234fc,dark_knight_57,Touchdown! New stock of Oxy just landed. Telegram link in bio.,Instagram,2025-12-29T15:56:15.626863,85,Dealer,#,simulation
f90d6c8acc7b,blue_sky_81,Brother need Oxy? I have best quality maal. Contact me.,Telegram,2025-12-29T15:56:15.626966,96,Dealer,#,simulation
b285d90b8ab1,blue_sky_27,Touchdown! New stock of MTP Kit just landed. Telegram link in bio.,Reddit,2025-12-29T15:56:15.627064,96,Dealer,#,simulation
