id,user,content,platform,timestamp,risk_score,type,url,query_source,original_content,language,final_threat,status
6d931592185d,city_plug_49,discrete delivery of mtp kit available in delhi/mumbai. cash on delivery.,Reddit,2025-12-29T16:43:47.919236,81,Dealer,#,simulation,Discrete delivery of MTP Kit available in Delhi/Mumbai. Cash on delivery.,en,99,CRITICAL
4ac5cdfbb965,meds_24x7_30,discrete delivery of steroids available in delhi/mumbai. cash on delivery.,Reddit,2025-12-29T16:43:47.919342,96,Dealer,#,simulation,Discrete delivery of Steroids available in Delhi/Mumbai. Cash on delivery.,en,99,CRITICAL
f7802b6822c1,dark_knight_53,touchdowni new stock of steroids just landed. telegram link in bio.,Telegram,2025-12-29T16:43:47.919365,82,Dealer,#,simulation,Touchdown! New stock of Steroids just landed. Telegram link in bio.,en,99,CRITICAL
266689ba3fa6,meds_24x7_48,touchdowni new stock of xanax just landed. telegram link in bio.,Telegram,2025-12-29T16:43:47.919380,95,Dealer,#,simulation,Touchdown! New stock of Xanax just landed. Telegram link in bio.,en,99,CRITICAL
33632a1c27b3,city_plug_12,touchdowni new stock of ganja just landed. telegram link in bio.,Reddit,2025-12-29T16:43:47.919391,90,Dealer,#,simulation,Touchdown! New stock of Ganja just landed. Telegram link in bio.,en,99,CRITICAL
99ae6e777109,crypto_vendor_38,bulk orders of ganja available. wickr me: fastplug. price list in bio.,Instagram,2025-12-29T16:43:47.919404,80,Dealer,#,simulation,Bulk orders of Ganja available. Wickr me: fastplug. Price list in bio.,en,99,CRITICAL
e1a7f4bb10e8,meds_24x7_93,brother need weed? i have best quality maal. contact me.,Reddit,2025-12-29T16:43:47.919416,87,Dealer,#,simulation,Brother need Weed? I have best quality maal. Contact me.,en,99,CRITICAL
1294fe945b60,city_plug_93,brother need charas? i have best quality maal. contact me.,Reddit,2025-12-29T16:43:47.919426,78,Dealer,#,simulation,Brother need Charas? I have best quality maal. Contact me.,en,90,CRITICAL
2644a3e29f67,meds_24x7_57,dm for menu. shipping worldwide. ioo% legit ganja. esafe eganja,Telegram,2025-12-29T16:43:47.919436,93,Dealer,#,simulation,DM for menu. Shipping worldwide. 100% legit Ganja. #safe #Ganja,en,99,CRITICAL
