id,user,content,platform,timestamp,risk_score,type,url,query_source,original_content,language,final_threat,status
02d5d1d6b61c,dark_knight_85,touchdowni new stock of ganja just landed. telegram link in bio.,Telegram,2025-12-29T16:08:49.975696,93,Dealer,#,simulation,Touchdown! New stock of Ganja just landed. Telegram link in bio.,en,99,CRITICAL
d62b021801d3,meds_24x7_58,brother need charas? i have best quality maal. contact me.,Reddit,2025-12-29T16:08:49.975803,77,Dealer,#,simulation,Brother need Charas? I have best quality maal. Contact me.,en,89,CRITICAL
e9d27482c3b0,crypto_vendor_81,brother need xanax? i have best quality maal. contact me.,Telegram,2025-12-29T16:08:49.975839,86,Dealer,#,simulation,Brother need Xanax? I have best quality maal. Contact me.,en,86,CRITICAL
61b46fca5a08,meds_24x7_30,discrete delivery of weed available in delhi/mumbai. cash on delivery.,Instagram,2025-12-29T16:08:49.975866,97,Dealer,#,simulation,Discrete delivery of Weed available in Delhi/Mumbai. Cash on delivery.,en,99,CRITICAL
78c9e10704b9,dark_knight_90,selling leftover script weed. dm me for prices. cash/btc only.,Reddit,2025-12-29T16:08:49.975887,79,Dealer,#,simulation,Selling leftover script Weed. DM me for prices. Cash/BTC only.,en,99,CRITICAL
2e5cb6ed61b1,meds_24x7_19,dm for menu. shipping worldwide. ioo% legit oxy. esafe eoxy,Telegram,2025-12-29T16:08:49.975916,88,Dealer,#,simulation,DM for menu. Shipping worldwide. 100% legit Oxy. #safe #Oxy,en,99,CRITICAL
