id,user,content,platform,timestamp,risk_score,type,url,query_source,original_content,language,final_threat,status
32422c7feb60,dark_knight_71,selling leftover script weed. dm me for prices. cash/btc only.,Reddit,2025-12-29T16:18:39.962124,91,Dealer,#,simulation,Selling leftover script Weed. DM me for prices. Cash/BTC only.,en,99,CRITICAL
5345fd519fd9,anon_user_83,selling leftover script weed. dm me for prices. cash/btc only.,Instagram,2025-12-29T16:18:39.962186,86,Dealer,#,simulation,Selling leftover script Weed. DM me for prices. Cash/BTC only.,en,99,CRITICAL
33b0a22ec7a7,city_plug_83,dm for menu. shipping worldwide. ioo% legit oxy. esafe eoxy,Telegram,2025-12-29T16:18:39.962242,83,Dealer,#,simulation,DM for menu. Shipping worldwide. 100% legit Oxy. #safe #Oxy,en,99,CRITICAL
014b42f31df0,blue_sky_96,mtp kit available fast shipping. no prescription needed.,Reddit,2025-12-29T16:18:39.962267,81,Dealer,#,simulation,MTP Kit available fast shipping. No prescription needed.,en,99,CRITICAL
09330de7d8dc,meds_24x7_73,touchdowni new stock of mtp kit just landed. telegram link in bio.,Telegram,2025-12-29T16:18:39.962292,95,Dealer,#,simulation,Touchdown! New stock of MTP Kit just landed. Telegram link in bio.,en,99,CRITICAL
28534a8c997a,crypto_vendor_92,selling leftover script xanax. dm me for prices. cash/btc only.,Reddit,2025-12-29T16:18:39.962313,97,Dealer,#,simulation,Selling leftover script Xanax. DM me for prices. Cash/BTC only.,en,99,CRITICAL
5793c36cd3ee,meds_24x7_82,dm for menu. shipping worldwide. ioo% legit weed. esafe eweed,Telegram,2025-12-29T16:18:39.962335,80,Dealer,#,simulation,DM for menu. Shipping worldwide. 100% legit Weed. #safe #Weed,en,99,CRITICAL
4d034e99f419,meds_24x7_22,brother need oxy? i have best quality maal. contact me.,Telegram,2025-12-29T16:18:39.962356,76,Dealer,#,simulation,Brother need Oxy? I have best quality maal. Contact me.,en,76,SUSPICIOUS
a7ca08911926,crypto_vendor_86,touchdowni new stock of xanax just landed. telegram link in bio.,Telegram,2025-12-29T16:18:39.962375,95,Dealer,#,simulation,Touchdown! New stock of Xanax just landed. Telegram link in bio.,en,99,CRITICAL
