id,user,content,platform,timestamp,risk_score,type,url,query_source
0684ae470052,blue_sky_59,DM for menu. Shipping worldwide. 100% legit Oxy. #safe #Oxy,Reddit,2025-12-29T16:44:56.413429,92,Dealer,#,simulation
9719ecffe42b,blue_sky_85,Selling leftover script Xanax. DM me for prices. Cash/BTC only.,Telegram,2025-12-29T16:44:56.413648,82,Dealer,#,simulation
dd679dba5d3e,anon_user_14,Bulk orders of Xanax available. Wickr me: fastplug. Price list in bio.,Telegram,2025-12-29T16:44:56.413687,76,Dealer,#,simulation
e7677a36dadc,dark_knight_10,Bulk orders of Ganja available. Wickr me: fastplug. Price list in bio.,Instagram,2025-12-29T16:44:56.413708,99,Dealer,#,simulation
d2d0c0e136a0,meds_24x7_67,Bulk orders of Charas available. Wickr me: fastplug. Price list in bio.,Reddit,2025-12-29T16:44:56.413731,89,Dealer,#,simulation
ed252958b6a4,crypto_vendor_95,Brother need Weed? I have best quality maal. Contact me.,Reddit,2025-12-29T16:44:56.413752,93,Dealer,#,simulation
19cc4df3b5dd,city_plug_49,MTP Kit available fast shipping. No prescription needed.,Telegram,2025-12-29T16:44:56.413777,79,Dealer,#,simulation
e6b924da066a,blue_sky_88,Bulk orders of Charas available. Wickr me: fastplug. Price list in bio.,Instagram,2025-12-29T16:44:56.413796,84,Dealer,#,simulation
b27b5fcdd6df,crypto_vendor_58,Brother need Xanax? I have best quality maal. Contact me.,Instagram,2025-12-29T16:44:56.413808,80,Dealer,#,simulation
d40295ab550e,meds_24x7_53,Discrete delivery of Steroids available in Delhi/Mumbai. Cash on delivery.,Telegram,2025-12-29T16:44:56.413830,89,Dealer,#,simulation
