id,user,content,platform,timestamp,risk_score,type,url,query_source
f106df4e5cd7,dark_knight_71,Bulk orders of Weed available. Wickr me: fastplug. Price list in bio.,Reddit,2025-12-29T16:00:36.071291,88,Dealer,#,simulation
2811023bde88,city_plug_97,DM for menu. Shipping worldwide. 100% legit Steroids. #safe #Steroids,Instagram,2025-12-29T16:00:36.071372,75,Dealer,#,simulation
e27248c91924,meds_24x7_62,Touchdown! New stock of Oxy just landed. Telegram link in bio.,Telegram,2025-12-29T16:00:36.071395,75,Dealer,#,simulation
3e653ea1a59b,dark_knight_26,DM for menu. Shipping worldwide. 100% legit Steroids. #safe #Steroids,Instagram,2025-12-29T16:00:36.071412,86,Dealer,#,simulation
3201815e72ee,dark_knight_38,Selling leftover script Charas. DM me for prices. Cash/BTC only.,Instagram,2025-12-29T16:00:36.071427,84,Dealer,#,simulation
a73f0242f4fb,dark_knight_81,DM for menu. Shipping worldwide. 100% legit Oxy. #safe #Oxy,Reddit,2025-12-29T16:00:36.071442,84,Dealer,#,simulation
