id,user,content,platform,timestamp,risk_score,type,url,query_source,original_content,language,final_threat,status
3e11478009da,city_plug_27,selling leftover script xanax. dm me for prices. cash/btc only.,Instagram,2025-12-29T15:58:43.439431,99,Dealer,#,simulation,Selling leftover script Xanax. DM me for prices. Cash/BTC only.,en,99,CRITICAL
e0494afc0772,city_plug_73,brother need xanax? i have best quality maal. contact me.,Reddit,2025-12-29T15:58:43.439603,83,Dealer,#,simulation,Brother need Xanax? I have best quality maal. Contact me.,en,83,CRITICAL
098d2788900a,city_plug_98,touchdowni new stock of charas just landed. telegram link in bio.,Telegram,2025-12-29T15:58:43.439632,96,Dealer,#,simulation,Touchdown! New stock of Charas just landed. Telegram link in bio.,en,99,CRITICAL
540471926263,blue_sky_61,mtp kit available fast shipping. no prescription needed.,Reddit,2025-12-29T15:58:43.439650,78,Dealer,#,simulation,MTP Kit available fast shipping. No prescription needed.,en,99,CRITICAL
aeaaa6f0e634,city_plug_47,selling leftover script oxy. dm me for prices. cash/btc only.,Telegram,2025-12-29T15:58:43.439667,87,Dealer,#,simulation,Selling leftover script Oxy. DM me for prices. Cash/BTC only.,en,99,CRITICAL
5244a09c01d0,anon_user_89,selling leftover script oxy. dm me for prices. cash/btc only.,Reddit,2025-12-29T15:58:43.439684,84,Dealer,#,simulation,Selling leftover script Oxy. DM me for prices. Cash/BTC only.,en,96,CRITICAL
e024f0597199,blue_sky_40,selling leftover script weed. dm me for prices. cash/btc only.,Reddit,2025-12-29T15:58:43.439704,83,Dealer,#,simulation,Selling leftover script Weed. DM me for prices. Cash/BTC only.,en,99,CRITICAL
