id,user,content,platform,timestamp,risk_score,type,url,query_source
ccff342bd590,crypto_vendor_99,Discrete delivery of Steroids available in Delhi/Mumbai. Cash on delivery.,Reddit,2025-12-29T16:15:23.951873,84,Dealer,#,simulation
4cd66fd9b46d,meds_24x7_91,DM for menu. Shipping worldwide. 100% legit Steroids. #safe #Steroids,Instagram,2025-12-29T16:15:23.951923,88,Dealer,#,simulation
d023f19256e3,blue_sky_35,DM for menu. Shipping worldwide. 100% legit Xanax. #safe #Xanax,Reddit,2025-12-29T16:15:23.951936,76,Dealer,#,simulation
18553f6db574,city_plug_44,MTP Kit available fast shipping. No prescription needed.,Telegram,2025-12-29T16:15:23.951946,81,Dealer,#,simulation
ad703589ccb1,dark_knight_77,MTP Kit available fast shipping. No prescription needed.,Instagram,2025-12-29T16:15:23.951954,81,Dealer,#,simulation
1114e0ffff8f,meds_24x7_69,DM for menu. Shipping worldwide. 100% legit Steroids. #safe #Steroids,Reddit,2025-12-29T16:15:23.951962,91,Dealer,#,simulation
5c199e476fbc,city_plug_46,Selling leftover script MTP Kit. DM me for prices. Cash/BTC only.,Instagram,2025-12-29T16:15:23.951972,78,Dealer,#,simulation
4650c8f33fb4,city_plug_21,Discrete delivery of Weed available in Delhi/Mumbai. Cash on delivery.,Telegram,2025-12-29T16:15:23.951980,86,Dealer,#,simulation
298c4730738d,anon_user_96,Touchdown! New stock of Oxy just landed. Telegram link in bio.,Reddit,2025-12-29T16:15:23.951987,99,Dealer,#,simulation
